[
  {
    "id": "bronx-borough",
    "name": "Bronx",
    "kind": "BOROUGH",
    "county": "Bronx",
    "retailOptOut": false,
    "onsiteConsumptionOptOut": false,
    "optOutDate": null,
    "notes": "NYC boroughs are geographic records here; opt-out authority belongs to New York City, which is absent from OCM's current opt-out list.",
    "sources": [
      {
        "url": "https://cannabis.ny.gov/ocm-local-opt-out-data",
        "label": "OCM — Official Local Opt-Out List",
        "type": "OFFICIAL_REGISTRY",
        "retrievedAt": "2026-10-12T20:00:39.554Z"
      },
      {
        "url": "https://cannabis.ny.gov/localities",
        "label": "OCM — Localities",
        "type": "REGULATOR_PAGE",
        "retrievedAt": "2026-10-12T20:00:39.527Z"
      }
    ],
    "lastUpdated": "2026-10-12T20:00:39.527Z"
  },
  {
    "id": "brooklyn-borough",
    "name": "Brooklyn",
    "kind": "BOROUGH",
    "county": "Kings",
    "retailOptOut": false,
    "onsiteConsumptionOptOut": false,
    "optOutDate": null,
    "notes": "NYC boroughs are geographic records here; opt-out authority belongs to New York City, which is absent from OCM's current opt-out list.",
    "sources": [
      {
        "url": "https://cannabis.ny.gov/ocm-local-opt-out-data",
        "label": "OCM — Official Local Opt-Out List",
        "type": "OFFICIAL_REGISTRY",
        "retrievedAt": "2026-10-12T20:00:39.554Z"
      },
      {
        "url": "https://cannabis.ny.gov/localities",
        "label": "OCM — Localities",
        "type": "REGULATOR_PAGE",
        "retrievedAt": "2026-10-12T20:00:39.527Z"
      }
    ],
    "lastUpdated": "2026-10-12T20:00:39.527Z"
  },
  {
    "id": "manhattan-borough",
    "name": "Manhattan",
    "kind": "BOROUGH",
    "county": "New York",
    "retailOptOut": false,
    "onsiteConsumptionOptOut": false,
    "optOutDate": null,
    "notes": "NYC boroughs are geographic records here; opt-out authority belongs to New York City, which is absent from OCM's current opt-out list.",
    "sources": [
      {
        "url": "https://cannabis.ny.gov/ocm-local-opt-out-data",
        "label": "OCM — Official Local Opt-Out List",
        "type": "OFFICIAL_REGISTRY",
        "retrievedAt": "2026-10-12T20:00:39.554Z"
      },
      {
        "url": "https://cannabis.ny.gov/localities",
        "label": "OCM — Localities",
        "type": "REGULATOR_PAGE",
        "retrievedAt": "2026-10-12T20:00:39.527Z"
      }
    ],
    "lastUpdated": "2026-10-12T20:00:39.527Z"
  },
  {
    "id": "queens-borough",
    "name": "Queens",
    "kind": "BOROUGH",
    "county": "Queens",
    "retailOptOut": false,
    "onsiteConsumptionOptOut": false,
    "optOutDate": null,
    "notes": "NYC boroughs are geographic records here; opt-out authority belongs to New York City, which is absent from OCM's current opt-out list.",
    "sources": [
      {
        "url": "https://cannabis.ny.gov/ocm-local-opt-out-data",
        "label": "OCM — Official Local Opt-Out List",
        "type": "OFFICIAL_REGISTRY",
        "retrievedAt": "2026-10-12T20:00:39.554Z"
      },
      {
        "url": "https://cannabis.ny.gov/localities",
        "label": "OCM — Localities",
        "type": "REGULATOR_PAGE",
        "retrievedAt": "2026-10-12T20:00:39.527Z"
      }
    ],
    "lastUpdated": "2026-10-12T20:00:39.527Z"
  },
  {
    "id": "staten-island-borough",
    "name": "Staten Island",
    "kind": "BOROUGH",
    "county": "Richmond",
    "retailOptOut": false,
    "onsiteConsumptionOptOut": false,
    "optOutDate": null,
    "notes": "NYC boroughs are geographic records here; opt-out authority belongs to New York City, which is absent from OCM's current opt-out list.",
    "sources": [
      {
        "url": "https://cannabis.ny.gov/ocm-local-opt-out-data",
        "label": "OCM — Official Local Opt-Out List",
        "type": "OFFICIAL_REGISTRY",
        "retrievedAt": "2026-10-12T20:00:39.554Z"
      },
      {
        "url": "https://cannabis.ny.gov/localities",
        "label": "OCM — Localities",
        "type": "REGULATOR_PAGE",
        "retrievedAt": "2026-10-12T20:00:39.527Z"
      }
    ],
    "lastUpdated": "2026-10-12T20:00:39.527Z"
  },
  {
    "id": "ardsley-village",
    "name": "Ardsley",
    "kind": "VILLAGE",
    "county": "Westchester",
    "retailOptOut": false,
    "onsiteConsumptionOptOut": false,
    "optOutDate": null,
    "notes": null,
    "sources": [
      {
        "url": "https://cannabis.ny.gov/ocm-local-opt-out-data",
        "label": "OCM — Official Local Opt-Out List",
        "type": "OFFICIAL_REGISTRY",
        "retrievedAt": "2026-10-12T20:00:39.554Z"
      },
      {
        "url": "https://giswww.westchestergov.com/arcgis/rest/services/WestchesterCountyBaseMap_Gray/MapServer/1",
        "label": "Westchester County GIS — Municipal Boundary layer",
        "type": "REGULATOR_PAGE",
        "retrievedAt": "2026-09-04T00:00:00.000Z"
      }
    ],
    "lastUpdated": "2026-10-12T20:00:39.527Z"
  },
  {
    "id": "bedford-town",
    "name": "Bedford",
    "kind": "TOWN",
    "county": "Westchester",
    "retailOptOut": true,
    "onsiteConsumptionOptOut": true,
    "optOutDate": null,
    "notes": null,
    "sources": [
      {
        "url": "https://cannabis.ny.gov/ocm-local-opt-out-data",
        "label": "OCM — Official Local Opt-Out List",
        "type": "OFFICIAL_REGISTRY",
        "retrievedAt": "2026-10-12T20:00:39.554Z"
      },
      {
        "url": "https://giswww.westchestergov.com/arcgis/rest/services/WestchesterCountyBaseMap_Gray/MapServer/1",
        "label": "Westchester County GIS — Municipal Boundary layer",
        "type": "REGULATOR_PAGE",
        "retrievedAt": "2026-09-04T00:00:00.000Z"
      }
    ],
    "lastUpdated": "2026-10-12T20:00:39.527Z"
  },
  {
    "id": "briarcliff-manor-village",
    "name": "Briarcliff Manor",
    "kind": "VILLAGE",
    "county": "Westchester",
    "retailOptOut": true,
    "onsiteConsumptionOptOut": true,
    "optOutDate": null,
    "notes": null,
    "sources": [
      {
        "url": "https://cannabis.ny.gov/ocm-local-opt-out-data",
        "label": "OCM — Official Local Opt-Out List",
        "type": "OFFICIAL_REGISTRY",
        "retrievedAt": "2026-10-12T20:00:39.554Z"
      },
      {
        "url": "https://giswww.westchestergov.com/arcgis/rest/services/WestchesterCountyBaseMap_Gray/MapServer/1",
        "label": "Westchester County GIS — Municipal Boundary layer",
        "type": "REGULATOR_PAGE",
        "retrievedAt": "2026-09-04T00:00:00.000Z"
      }
    ],
    "lastUpdated": "2026-10-12T20:00:39.527Z"
  },
  {
    "id": "bronxville-village",
    "name": "Bronxville",
    "kind": "VILLAGE",
    "county": "Westchester",
    "retailOptOut": true,
    "onsiteConsumptionOptOut": true,
    "optOutDate": null,
    "notes": null,
    "sources": [
      {
        "url": "https://cannabis.ny.gov/ocm-local-opt-out-data",
        "label": "OCM — Official Local Opt-Out List",
        "type": "OFFICIAL_REGISTRY",
        "retrievedAt": "2026-10-12T20:00:39.554Z"
      },
      {
        "url": "https://giswww.westchestergov.com/arcgis/rest/services/WestchesterCountyBaseMap_Gray/MapServer/1",
        "label": "Westchester County GIS — Municipal Boundary layer",
        "type": "REGULATOR_PAGE",
        "retrievedAt": "2026-09-04T00:00:00.000Z"
      }
    ],
    "lastUpdated": "2026-10-12T20:00:39.527Z"
  },
  {
    "id": "buchanan-village",
    "name": "Buchanan",
    "kind": "VILLAGE",
    "county": "Westchester",
    "retailOptOut": true,
    "onsiteConsumptionOptOut": true,
    "optOutDate": null,
    "notes": null,
    "sources": [
      {
        "url": "https://cannabis.ny.gov/ocm-local-opt-out-data",
        "label": "OCM — Official Local Opt-Out List",
        "type": "OFFICIAL_REGISTRY",
        "retrievedAt": "2026-10-12T20:00:39.554Z"
      },
      {
        "url": "https://giswww.westchestergov.com/arcgis/rest/services/WestchesterCountyBaseMap_Gray/MapServer/1",
        "label": "Westchester County GIS — Municipal Boundary layer",
        "type": "REGULATOR_PAGE",
        "retrievedAt": "2026-09-04T00:00:00.000Z"
      }
    ],
    "lastUpdated": "2026-10-12T20:00:39.527Z"
  },
  {
    "id": "cortlandt-town",
    "name": "Cortlandt",
    "kind": "TOWN",
    "county": "Westchester",
    "retailOptOut": false,
    "onsiteConsumptionOptOut": true,
    "optOutDate": null,
    "notes": null,
    "sources": [
      {
        "url": "https://cannabis.ny.gov/ocm-local-opt-out-data",
        "label": "OCM — Official Local Opt-Out List",
        "type": "OFFICIAL_REGISTRY",
        "retrievedAt": "2026-10-12T20:00:39.554Z"
      },
      {
        "url": "https://giswww.westchestergov.com/arcgis/rest/services/WestchesterCountyBaseMap_Gray/MapServer/1",
        "label": "Westchester County GIS — Municipal Boundary layer",
        "type": "REGULATOR_PAGE",
        "retrievedAt": "2026-09-04T00:00:00.000Z"
      }
    ],
    "lastUpdated": "2026-10-12T20:00:39.527Z"
  },
  {
    "id": "croton-on-hudson-village",
    "name": "Croton-on-Hudson",
    "kind": "VILLAGE",
    "county": "Westchester",
    "retailOptOut": false,
    "onsiteConsumptionOptOut": true,
    "optOutDate": null,
    "notes": null,
    "sources": [
      {
        "url": "https://cannabis.ny.gov/ocm-local-opt-out-data",
        "label": "OCM — Official Local Opt-Out List",
        "type": "OFFICIAL_REGISTRY",
        "retrievedAt": "2026-10-12T20:00:39.554Z"
      },
      {
        "url": "https://giswww.westchestergov.com/arcgis/rest/services/WestchesterCountyBaseMap_Gray/MapServer/1",
        "label": "Westchester County GIS — Municipal Boundary layer",
        "type": "REGULATOR_PAGE",
        "retrievedAt": "2026-09-04T00:00:00.000Z"
      }
    ],
    "lastUpdated": "2026-10-12T20:00:39.527Z"
  },
  {
    "id": "dobbs-ferry-village",
    "name": "Dobbs Ferry",
    "kind": "VILLAGE",
    "county": "Westchester",
    "retailOptOut": true,
    "onsiteConsumptionOptOut": true,
    "optOutDate": null,